{
  "case_results": [
    {
      "case_id": "architecture-specific-fp-api-boundary-01",
      "exact": true,
      "rule_code": "architecture-specific-fp-api"
    },
    {
      "case_id": "architecture-specific-fp-api-budget-01",
      "exact": true,
      "rule_code": "architecture-specific-fp-api"
    },
    {
      "case_id": "architecture-specific-fp-api-negative-01",
      "exact": true,
      "rule_code": "architecture-specific-fp-api"
    },
    {
      "case_id": "architecture-specific-fp-api-negative-02",
      "exact": true,
      "rule_code": "architecture-specific-fp-api"
    },
    {
      "case_id": "architecture-specific-fp-api-negative-03",
      "exact": true,
      "rule_code": "architecture-specific-fp-api"
    },
    {
      "case_id": "architecture-specific-fp-api-negative-04",
      "exact": true,
      "rule_code": "architecture-specific-fp-api"
    },
    {
      "case_id": "architecture-specific-fp-api-negative-05",
      "exact": true,
      "rule_code": "architecture-specific-fp-api"
    },
    {
      "case_id": "architecture-specific-fp-api-negative-06",
      "exact": true,
      "rule_code": "architecture-specific-fp-api"
    },
    {
      "case_id": "architecture-specific-fp-api-positive-01",
      "exact": true,
      "rule_code": "architecture-specific-fp-api"
    },
    {
      "case_id": "architecture-specific-fp-api-positive-02",
      "exact": true,
      "rule_code": "architecture-specific-fp-api"
    },
    {
      "case_id": "architecture-specific-fp-api-positive-03",
      "exact": true,
      "rule_code": "architecture-specific-fp-api"
    },
    {
      "case_id": "architecture-specific-fp-api-positive-04",
      "exact": true,
      "rule_code": "architecture-specific-fp-api"
    },
    {
      "case_id": "architecture-specific-fp-api-positive-05",
      "exact": true,
      "rule_code": "architecture-specific-fp-api"
    },
    {
      "case_id": "architecture-specific-fp-api-positive-06",
      "exact": true,
      "rule_code": "architecture-specific-fp-api"
    },
    {
      "case_id": "architecture-specific-fp-api-suppression-01",
      "exact": true,
      "rule_code": "architecture-specific-fp-api"
    },
    {
      "case_id": "architecture-specific-fp-api-unknown-01",
      "exact": true,
      "rule_code": "architecture-specific-fp-api"
    },
    {
      "case_id": "architecture-specific-fp-api-unknown-02",
      "exact": true,
      "rule_code": "architecture-specific-fp-api"
    },
    {
      "case_id": "architecture-specific-fp-api-unknown-03",
      "exact": true,
      "rule_code": "architecture-specific-fp-api"
    },
    {
      "case_id": "floating-environment-boundary-01",
      "exact": true,
      "rule_code": "floating-environment"
    },
    {
      "case_id": "floating-environment-budget-01",
      "exact": true,
      "rule_code": "floating-environment"
    },
    {
      "case_id": "floating-environment-negative-01",
      "exact": true,
      "rule_code": "floating-environment"
    },
    {
      "case_id": "floating-environment-negative-02",
      "exact": true,
      "rule_code": "floating-environment"
    },
    {
      "case_id": "floating-environment-negative-03",
      "exact": true,
      "rule_code": "floating-environment"
    },
    {
      "case_id": "floating-environment-negative-04",
      "exact": true,
      "rule_code": "floating-environment"
    },
    {
      "case_id": "floating-environment-negative-05",
      "exact": true,
      "rule_code": "floating-environment"
    },
    {
      "case_id": "floating-environment-negative-06",
      "exact": true,
      "rule_code": "floating-environment"
    },
    {
      "case_id": "floating-environment-positive-01",
      "exact": true,
      "rule_code": "floating-environment"
    },
    {
      "case_id": "floating-environment-positive-02",
      "exact": true,
      "rule_code": "floating-environment"
    },
    {
      "case_id": "floating-environment-positive-03",
      "exact": true,
      "rule_code": "floating-environment"
    },
    {
      "case_id": "floating-environment-positive-04",
      "exact": true,
      "rule_code": "floating-environment"
    },
    {
      "case_id": "floating-environment-positive-05",
      "exact": true,
      "rule_code": "floating-environment"
    },
    {
      "case_id": "floating-environment-positive-06",
      "exact": true,
      "rule_code": "floating-environment"
    },
    {
      "case_id": "floating-environment-suppression-01",
      "exact": true,
      "rule_code": "floating-environment"
    },
    {
      "case_id": "floating-environment-unknown-01",
      "exact": true,
      "rule_code": "floating-environment"
    },
    {
      "case_id": "floating-environment-unknown-02",
      "exact": true,
      "rule_code": "floating-environment"
    },
    {
      "case_id": "floating-environment-unknown-03",
      "exact": true,
      "rule_code": "floating-environment"
    },
    {
      "case_id": "fma-contraction-boundary-01",
      "exact": true,
      "rule_code": "fma-contraction"
    },
    {
      "case_id": "fma-contraction-budget-01",
      "exact": true,
      "rule_code": "fma-contraction"
    },
    {
      "case_id": "fma-contraction-negative-01",
      "exact": true,
      "rule_code": "fma-contraction"
    },
    {
      "case_id": "fma-contraction-negative-02",
      "exact": true,
      "rule_code": "fma-contraction"
    },
    {
      "case_id": "fma-contraction-negative-03",
      "exact": true,
      "rule_code": "fma-contraction"
    },
    {
      "case_id": "fma-contraction-negative-04",
      "exact": true,
      "rule_code": "fma-contraction"
    },
    {
      "case_id": "fma-contraction-negative-05",
      "exact": true,
      "rule_code": "fma-contraction"
    },
    {
      "case_id": "fma-contraction-negative-06",
      "exact": true,
      "rule_code": "fma-contraction"
    },
    {
      "case_id": "fma-contraction-positive-01",
      "exact": true,
      "rule_code": "fma-contraction"
    },
    {
      "case_id": "fma-contraction-positive-02",
      "exact": true,
      "rule_code": "fma-contraction"
    },
    {
      "case_id": "fma-contraction-positive-03",
      "exact": true,
      "rule_code": "fma-contraction"
    },
    {
      "case_id": "fma-contraction-positive-04",
      "exact": true,
      "rule_code": "fma-contraction"
    },
    {
      "case_id": "fma-contraction-positive-05",
      "exact": true,
      "rule_code": "fma-contraction"
    },
    {
      "case_id": "fma-contraction-positive-06",
      "exact": true,
      "rule_code": "fma-contraction"
    },
    {
      "case_id": "fma-contraction-suppression-01",
      "exact": true,
      "rule_code": "fma-contraction"
    },
    {
      "case_id": "fma-contraction-unknown-01",
      "exact": true,
      "rule_code": "fma-contraction"
    },
    {
      "case_id": "fma-contraction-unknown-02",
      "exact": true,
      "rule_code": "fma-contraction"
    },
    {
      "case_id": "fma-contraction-unknown-03",
      "exact": true,
      "rule_code": "fma-contraction"
    },
    {
      "case_id": "fragile-fp-comparison-boundary-01",
      "exact": true,
      "rule_code": "fragile-fp-comparison"
    },
    {
      "case_id": "fragile-fp-comparison-budget-01",
      "exact": true,
      "rule_code": "fragile-fp-comparison"
    },
    {
      "case_id": "fragile-fp-comparison-negative-01",
      "exact": true,
      "rule_code": "fragile-fp-comparison"
    },
    {
      "case_id": "fragile-fp-comparison-negative-02",
      "exact": true,
      "rule_code": "fragile-fp-comparison"
    },
    {
      "case_id": "fragile-fp-comparison-negative-03",
      "exact": true,
      "rule_code": "fragile-fp-comparison"
    },
    {
      "case_id": "fragile-fp-comparison-negative-04",
      "exact": true,
      "rule_code": "fragile-fp-comparison"
    },
    {
      "case_id": "fragile-fp-comparison-negative-05",
      "exact": true,
      "rule_code": "fragile-fp-comparison"
    },
    {
      "case_id": "fragile-fp-comparison-negative-06",
      "exact": true,
      "rule_code": "fragile-fp-comparison"
    },
    {
      "case_id": "fragile-fp-comparison-positive-01",
      "exact": true,
      "rule_code": "fragile-fp-comparison"
    },
    {
      "case_id": "fragile-fp-comparison-positive-02",
      "exact": true,
      "rule_code": "fragile-fp-comparison"
    },
    {
      "case_id": "fragile-fp-comparison-positive-03",
      "exact": true,
      "rule_code": "fragile-fp-comparison"
    },
    {
      "case_id": "fragile-fp-comparison-positive-04",
      "exact": true,
      "rule_code": "fragile-fp-comparison"
    },
    {
      "case_id": "fragile-fp-comparison-positive-05",
      "exact": true,
      "rule_code": "fragile-fp-comparison"
    },
    {
      "case_id": "fragile-fp-comparison-positive-06",
      "exact": true,
      "rule_code": "fragile-fp-comparison"
    },
    {
      "case_id": "fragile-fp-comparison-suppression-01",
      "exact": true,
      "rule_code": "fragile-fp-comparison"
    },
    {
      "case_id": "fragile-fp-comparison-unknown-01",
      "exact": true,
      "rule_code": "fragile-fp-comparison"
    },
    {
      "case_id": "fragile-fp-comparison-unknown-02",
      "exact": true,
      "rule_code": "fragile-fp-comparison"
    },
    {
      "case_id": "fragile-fp-comparison-unknown-03",
      "exact": true,
      "rule_code": "fragile-fp-comparison"
    },
    {
      "case_id": "long-double-abi-boundary-01",
      "exact": true,
      "rule_code": "long-double-abi"
    },
    {
      "case_id": "long-double-abi-budget-01",
      "exact": true,
      "rule_code": "long-double-abi"
    },
    {
      "case_id": "long-double-abi-negative-01",
      "exact": true,
      "rule_code": "long-double-abi"
    },
    {
      "case_id": "long-double-abi-negative-02",
      "exact": true,
      "rule_code": "long-double-abi"
    },
    {
      "case_id": "long-double-abi-negative-03",
      "exact": true,